{
  "$schema": "https://json-schema.org/draft/2020-12/schema",
  "$id": "https://omnipitch.local/contracts/insight.schema.json",
  "title": "insight",
  "type": "object",
  "additionalProperties": false,
  "required": [
    "schema_version",
    "run_id",
    "match_id",
    "moment_id",
    "headline",
    "casual_text",
    "analyst_text",
    "language",
    "evidence_ids",
    "metrics",
    "limitations",
    "generation_mode"
  ],
  "properties": {
    "schema_version": {
      "const": "1.0"
    },
    "run_id": {
      "type": "string",
      "minLength": 1
    },
    "match_id": {
      "type": "string",
      "minLength": 1
    },
    "moment_id": {
      "type": "string",
      "minLength": 1
    },
    "headline": {
      "type": "string",
      "minLength": 1
    },
    "casual_text": {
      "type": "string",
      "minLength": 1
    },
    "analyst_text": {
      "type": "string",
      "minLength": 1
    },
    "language": {
      "type": "string",
      "enum": [
        "en"
      ]
    },
    "evidence_ids": {
      "type": "array",
      "minItems": 1,
      "uniqueItems": true,
      "items": {
        "type": "string",
        "minLength": 1
      }
    },
    "metrics": {
      "type": "array",
      "items": {
        "type": "object",
        "additionalProperties": false,
        "required": [
          "name",
          "value",
          "unit"
        ],
        "properties": {
          "name": {
            "type": "string",
            "minLength": 1
          },
          "value": {
            "type": "number"
          },
          "unit": {
            "type": "string",
            "minLength": 1
          }
        }
      }
    },
    "limitations": {
      "type": "array",
      "minItems": 1,
      "items": {
        "type": "string",
        "minLength": 1
      }
    },
    "generation_mode": {
      "const": "fixture"
    }
  }
}
